{
  "schema_version": "1.0",
  "id": "protest-v",
  "slug": "protest-v",
  "headword": "protest",
  "pos": "v",
  "homograph": 1,
  "variants": [],
  "pronunciation": {
    "american": {
      "ipa": "prəˈtɛst",
      "source": "model:anthropic/claude-sonnet-5",
      "checked_by": "agreement:4/4;cmudict:agree",
      "status": "verified"
    },
    "british": {
      "ipa": "prəˈtest",
      "source": "model:anthropic/claude-sonnet-5",
      "checked_by": "agreement:3/3",
      "status": "verified"
    },
    "variants": [
      {
        "ipa": "ˈproʊ.tɛst",
        "region": "American",
        "note": "Many American speakers stress the first part for the verb too: *PROH-test*."
      }
    ],
    "audio": null,
    "notes": null
  },
  "inflections": {
    "forms": {
      "third_person_singular": "protests",
      "past_tense": "protested",
      "past_participle": "protested",
      "present_participle": "protesting"
    },
    "regular": true,
    "source": "rules",
    "status": "verified",
    "note": null
  },
  "frequency": {
    "band": 2,
    "basis": "editorial",
    "defining_vocabulary": true
  },
  "labels": {
    "register": [],
    "region": [],
    "domain": [],
    "currency": [],
    "attitude": []
  },
  "core_idea": "To protest is to say or show strongly that you do not agree, or that something is true when others doubt it.",
  "senses": [
    {
      "n": 1,
      "signpost": "in public",
      "definition": "show publicly that you strongly disagree with something, for example by joining a march or holding signs",
      "explanation": null,
      "grammar": {
        "countability": null,
        "transitivity": "transitive or intransitive",
        "codes": [],
        "patterns": [
          "verb + preposition + object",
          "verb + object",
          "verb + adverb or preposition"
        ]
      },
      "labels": {
        "register": [],
        "region": [],
        "domain": [],
        "currency": [],
        "attitude": []
      },
      "pronunciation": null,
      "examples": [
        {
          "text": "Thousands of people protested against the new tax.",
          "note": null,
          "pattern": "verb + preposition + object"
        },
        {
          "text": "Students gathered outside to protest the decision.",
          "note": null,
          "pattern": "verb + object"
        },
        {
          "text": "Workers are protesting about low pay.",
          "note": null,
          "pattern": "verb + preposition + object"
        },
        {
          "text": "A small group protested peacefully outside the building.",
          "note": null,
          "pattern": "verb + adverb or preposition"
        }
      ],
      "collocations": [
        {
          "type": "verb + preposition",
          "items": [
            "protest against",
            "protest about",
            "protest at"
          ]
        },
        {
          "type": "verb + adverb",
          "items": [
            "protest peacefully",
            "protest loudly"
          ]
        },
        {
          "type": "verb + noun",
          "items": [
            "protest a decision",
            "protest a law"
          ]
        }
      ],
      "synonyms": [
        {
          "slug": "demonstrate-v",
          "note": null
        }
      ],
      "antonyms": [],
      "compare": [],
      "subsenses": [],
      "adaptation": {
        "semantic": null,
        "grammar": null,
        "culture": null,
        "false_friends": null,
        "pronunciation": null
      },
      "l1": {}
    },
    {
      "n": 2,
      "signpost": "complain",
      "definition": "say strongly that you do not agree with something or are not happy about it",
      "explanation": null,
      "grammar": {
        "countability": null,
        "transitivity": "transitive or intransitive",
        "codes": [],
        "patterns": [
          "verb + that-clause",
          "verb + direct speech",
          "verb + preposition + object"
        ]
      },
      "labels": {
        "register": [],
        "region": [],
        "domain": [],
        "currency": [],
        "attitude": []
      },
      "pronunciation": null,
      "examples": [
        {
          "text": "\"But I haven't finished!\" she protested.",
          "note": null,
          "pattern": "verb + direct speech"
        },
        {
          "text": "He protested that the test was unfair.",
          "note": null,
          "pattern": "verb + that-clause"
        },
        {
          "text": "The children protested when it was time for bed.",
          "note": null,
          "pattern": null
        },
        {
          "text": "Neighbors protested to the owner about the noise.",
          "note": null,
          "pattern": "verb + preposition + object"
        }
      ],
      "collocations": [
        {
          "type": "verb + preposition",
          "items": [
            "protest to someone",
            "protest about something"
          ]
        }
      ],
      "synonyms": [
        {
          "slug": "object-v",
          "note": null
        }
      ],
      "antonyms": [],
      "compare": [
        {
          "slug": "complain-v",
          "note": null
        }
      ],
      "subsenses": [],
      "adaptation": {
        "semantic": null,
        "grammar": null,
        "culture": null,
        "false_friends": null,
        "pronunciation": null
      },
      "l1": {}
    },
    {
      "n": 3,
      "signpost": "say firmly",
      "definition": "say firmly that something is true, especially when other people do not believe you",
      "explanation": null,
      "grammar": {
        "countability": null,
        "transitivity": "transitive",
        "codes": [],
        "patterns": [
          "verb + object",
          "verb + that-clause"
        ]
      },
      "labels": {
        "register": [],
        "region": [],
        "domain": [],
        "currency": [],
        "attitude": []
      },
      "pronunciation": null,
      "examples": [
        {
          "text": "She has always protested her innocence.",
          "note": null,
          "pattern": "verb + object"
        },
        {
          "text": "He protested that he had never seen the money.",
          "note": null,
          "pattern": "verb + that-clause"
        }
      ],
      "collocations": [
        {
          "type": "verb + noun",
          "items": [
            "protest your innocence"
          ]
        }
      ],
      "synonyms": [],
      "antonyms": [],
      "compare": [],
      "subsenses": [],
      "adaptation": {
        "semantic": null,
        "grammar": null,
        "culture": null,
        "false_friends": null,
        "pronunciation": null
      },
      "l1": {}
    }
  ],
  "phrases": [],
  "word_family": [
    {
      "slug": "protest-n",
      "form": null,
      "note": null
    },
    {
      "slug": "protester-n",
      "form": null,
      "note": null
    }
  ],
  "synonym_discrimination": null,
  "usage_note": "In American English **protest** in the public sense often takes a direct object (*protest the war*). British English usually adds **against** or **about** (*protest against the war*).",
  "learner_errors": [],
  "etymology": null,
  "see_also": [],
  "adaptation": {
    "semantic": null,
    "grammar": null,
    "culture": null,
    "false_friends": null,
    "pronunciation": "The verb is usually stressed on the second part, *pruh-TEST*, and the noun on the first, *PROH-test*."
  },
  "l1": {},
  "provenance": {
    "created": "2026-10-31T12:46:30Z",
    "modified": "2026-10-31T12:56:09Z",
    "drafted_by": "anthropic/claude-sonnet-5",
    "run_id": "20261031T124436Z-k012k2",
    "reviews": [
      {
        "run_id": "20261031T124436Z-k012k2",
        "role": "reviewer-a",
        "model": "claude-cli/claude-sonnet-5-5",
        "date": "2026-10-31",
        "file": "reviews/20261031T124436Z-k012k2/protest-v.json",
        "ok": 43,
        "issues": 2,
        "blocking": 0
      },
      {
        "run_id": "20261031T124436Z-k012k2",
        "role": "reviewer-b",
        "model": "google/gemini-4-argon",
        "date": "2026-10-31",
        "file": "reviews/20261031T124436Z-k012k2/protest-v.json",
        "ok": 44,
        "issues": 1,
        "blocking": 0
      }
    ],
    "status": "reviewed",
    "flags": [],
    "notes": null
  }
}
