{
  "schema_version": "1.0",
  "id": "printer-n",
  "slug": "printer-n",
  "headword": "printer",
  "pos": "n",
  "homograph": 1,
  "variants": [],
  "pronunciation": {
    "american": {
      "ipa": "ˈprɪn.tɚ",
      "source": "model:anthropic/claude-sonnet-5",
      "checked_by": "agreement:4/4;cmudict:agree",
      "status": "verified"
    },
    "british": {
      "ipa": "ˈprɪn.tə",
      "source": "model:anthropic/claude-sonnet-5",
      "checked_by": "agreement:3/3",
      "status": "verified"
    },
    "variants": [],
    "audio": null,
    "notes": null
  },
  "inflections": {
    "forms": {
      "plural": "printers"
    },
    "regular": true,
    "source": "rules",
    "status": "verified",
    "note": null
  },
  "frequency": {
    "band": 2,
    "basis": "editorial",
    "defining_vocabulary": true
  },
  "labels": {
    "register": [],
    "region": [],
    "domain": [],
    "currency": [],
    "attitude": []
  },
  "core_idea": null,
  "senses": [
    {
      "n": 1,
      "signpost": "machine",
      "definition": "a machine, usually connected to a computer, that puts words or pictures onto paper",
      "explanation": null,
      "grammar": {
        "countability": "countable",
        "transitivity": null,
        "codes": [],
        "patterns": []
      },
      "labels": {
        "register": [],
        "region": [],
        "domain": [
          "computing"
        ],
        "currency": [],
        "attitude": []
      },
      "pronunciation": null,
      "examples": [
        {
          "text": "The printer has run out of paper.",
          "note": null,
          "pattern": null
        },
        {
          "text": "Can I send this file to your printer?",
          "note": null,
          "pattern": null
        },
        {
          "text": "Our office printer breaks down every week.",
          "note": null,
          "pattern": null
        }
      ],
      "collocations": [
        {
          "type": "noun + noun",
          "items": [
            "a laser printer",
            "an office printer",
            "printer ink",
            "printer paper"
          ]
        },
        {
          "type": "verb + noun",
          "items": [
            "connect a printer",
            "send something to the printer"
          ]
        },
        {
          "type": "noun + verb",
          "items": [
            "the printer jams"
          ]
        }
      ],
      "synonyms": [],
      "antonyms": [],
      "compare": [],
      "subsenses": [
        {
          "letter": "a",
          "definition": "a machine that makes solid objects by building them up in very thin layers",
          "explanation": null,
          "grammar": {
            "countability": "countable",
            "transitivity": null,
            "codes": [],
            "patterns": []
          },
          "labels": {
            "register": [],
            "region": [],
            "domain": [],
            "currency": [],
            "attitude": []
          },
          "examples": [
            {
              "text": "The school bought a 3D printer for the art room.",
              "note": null,
              "pattern": null
            },
            {
              "text": "He made the missing part with a 3D printer.",
              "note": null,
              "pattern": null
            }
          ],
          "collocations": [
            {
              "type": "noun + noun",
              "items": [
                "a 3D printer"
              ]
            }
          ]
        }
      ],
      "adaptation": {
        "semantic": null,
        "grammar": null,
        "culture": null,
        "false_friends": null,
        "pronunciation": null
      },
      "l1": {}
    },
    {
      "n": 2,
      "signpost": "person or business",
      "definition": "a person or company whose business is putting words and pictures onto paper to make books, newspapers, or signs, or the place where they work",
      "explanation": null,
      "grammar": {
        "countability": "countable",
        "transitivity": null,
        "codes": [],
        "patterns": []
      },
      "labels": {
        "register": [],
        "region": [],
        "domain": [],
        "currency": [],
        "attitude": []
      },
      "pronunciation": null,
      "examples": [
        {
          "text": "The printers will have the posters ready by Friday.",
          "note": null,
          "pattern": null
        },
        {
          "text": "The book is at the printer's now.",
          "note": null,
          "pattern": null
        }
      ],
      "collocations": [
        {
          "type": "phrase",
          "items": [
            "at the printer's",
            "send something to the printer's"
          ]
        }
      ],
      "synonyms": [],
      "antonyms": [],
      "compare": [],
      "subsenses": [],
      "adaptation": {
        "semantic": null,
        "grammar": null,
        "culture": null,
        "false_friends": null,
        "pronunciation": null
      },
      "l1": {}
    }
  ],
  "phrases": [],
  "word_family": [
    {
      "slug": "print-v",
      "form": null,
      "note": null
    },
    {
      "slug": "print-n",
      "form": null,
      "note": null
    }
  ],
  "synonym_discrimination": null,
  "usage_note": null,
  "learner_errors": [],
  "etymology": null,
  "see_also": [],
  "adaptation": {
    "semantic": null,
    "grammar": null,
    "culture": null,
    "false_friends": null,
    "pronunciation": null
  },
  "l1": {},
  "provenance": {
    "created": "2026-10-25T13:22:58Z",
    "modified": "2026-10-25T13:33:22Z",
    "drafted_by": "anthropic/claude-sonnet-5",
    "run_id": "20261025T132124Z-twauz7",
    "reviews": [
      {
        "run_id": "20261025T132124Z-twauz7",
        "role": "reviewer-a",
        "model": "claude-cli/claude-sonnet-5-5",
        "date": "2026-10-25",
        "file": "reviews/20261025T132124Z-twauz7/printer-n.json",
        "ok": 34,
        "issues": 2,
        "blocking": 0
      },
      {
        "run_id": "20261025T132124Z-twauz7",
        "role": "reviewer-b",
        "model": "google/gemini-3.1-pro-preview",
        "date": "2026-10-25",
        "file": "reviews/20261025T132124Z-twauz7/printer-n.json",
        "ok": 35,
        "issues": 1,
        "blocking": 0
      }
    ],
    "status": "reviewed",
    "flags": [],
    "notes": null
  }
}
