{
  "schema_version": "1.0",
  "id": "shore-n",
  "slug": "shore-n",
  "headword": "shore",
  "pos": "n",
  "homograph": 1,
  "variants": [],
  "pronunciation": {
    "american": {
      "ipa": "ʃɔr",
      "source": "model:anthropic/claude-sonnet-5",
      "checked_by": "agreement:4/4;cmudict:agree",
      "status": "verified"
    },
    "british": {
      "ipa": "ʃɔː",
      "source": "model:anthropic/claude-sonnet-5",
      "checked_by": "agreement:3/3",
      "status": "verified"
    },
    "variants": [],
    "audio": null,
    "notes": "One part, rhyming with **more**."
  },
  "inflections": {
    "forms": {
      "plural": "shores"
    },
    "regular": true,
    "source": "rules",
    "status": "verified",
    "note": null
  },
  "frequency": {
    "band": 1,
    "basis": "editorial",
    "defining_vocabulary": true
  },
  "labels": {
    "register": [],
    "region": [],
    "domain": [],
    "currency": [],
    "attitude": []
  },
  "core_idea": null,
  "senses": [
    {
      "n": 1,
      "signpost": "by the water",
      "definition": "the land along the edge of a sea, a lake, or a very wide river",
      "explanation": "**On shore** means on land, not on a ship (*the sailors spent the night on shore*).",
      "grammar": {
        "countability": "countable",
        "transitivity": null,
        "codes": [],
        "patterns": []
      },
      "labels": {
        "register": [],
        "region": [],
        "domain": [],
        "currency": [],
        "attitude": []
      },
      "pronunciation": null,
      "examples": [
        {
          "text": "We walked along the shore at sunset.",
          "note": null,
          "pattern": null
        },
        {
          "text": "The boat stayed close to the shore.",
          "note": null,
          "pattern": null
        },
        {
          "text": "Waves were breaking on the shore.",
          "note": null,
          "pattern": null
        },
        {
          "text": "They swam back to shore before the storm.",
          "note": null,
          "pattern": null
        }
      ],
      "collocations": [
        {
          "type": "preposition + noun",
          "items": [
            "on the shore",
            "along the shore",
            "to shore",
            "on shore",
            "off the shore"
          ]
        },
        {
          "type": "adjective + noun",
          "items": [
            "the rocky shore",
            "the far shore",
            "the opposite shore"
          ]
        },
        {
          "type": "noun + noun",
          "items": [
            "the lake shore"
          ]
        }
      ],
      "synonyms": [],
      "antonyms": [],
      "compare": [
        {
          "slug": "beach-n",
          "note": null
        },
        {
          "slug": "coast-n",
          "note": null
        },
        {
          "slug": "bank-n",
          "note": null
        }
      ],
      "subsenses": [],
      "adaptation": {
        "semantic": null,
        "grammar": null,
        "culture": null,
        "false_friends": null,
        "pronunciation": null
      },
      "l1": {}
    },
    {
      "n": 2,
      "signpost": "a country",
      "definition": "a country, especially one that is far away or across the sea",
      "explanation": null,
      "grammar": {
        "countability": "countable",
        "transitivity": null,
        "codes": [
          "usually plural"
        ],
        "patterns": []
      },
      "labels": {
        "register": [
          "literary"
        ],
        "region": [],
        "domain": [],
        "currency": [],
        "attitude": []
      },
      "pronunciation": null,
      "examples": [
        {
          "text": "He left these shores as a young man and never came back.",
          "note": null,
          "pattern": null
        },
        {
          "text": "Visitors to our shores are always welcome.",
          "note": null,
          "pattern": null
        }
      ],
      "collocations": [
        {
          "type": "phrase",
          "items": [
            "these shores",
            "foreign shores",
            "distant shores"
          ]
        }
      ],
      "synonyms": [],
      "antonyms": [],
      "compare": [],
      "subsenses": [],
      "adaptation": {
        "semantic": null,
        "grammar": null,
        "culture": null,
        "false_friends": null,
        "pronunciation": null
      },
      "l1": {}
    }
  ],
  "phrases": [],
  "word_family": [
    {
      "slug": "ashore-adv",
      "form": null,
      "note": null
    },
    {
      "slug": "shoreline-n",
      "form": null,
      "note": null
    },
    {
      "slug": "offshore-adj",
      "form": null,
      "note": null
    }
  ],
  "synonym_discrimination": {
    "words": [
      "shore-n",
      "coast-n",
      "beach-n",
      "bank-n"
    ],
    "note": "**Shore** is the land at the edge of a large area of water, usually a sea or a lake (*the shore of the lake*). **Coast** is used only for the sea and means the whole area of land near it (*a town on the coast*). A **beach** is an area of sand or small stones by the water, where people go to relax or swim. The land at the side of a river is usually its **bank**."
  },
  "usage_note": null,
  "learner_errors": [],
  "etymology": null,
  "see_also": [
    {
      "slug": "coast-n",
      "note": null
    }
  ],
  "adaptation": {
    "semantic": "\"shore\": many languages use one word for the edge of a sea, a lake, and a river; English says **shore** for a sea or a lake and usually **bank** for a river.",
    "grammar": null,
    "culture": null,
    "false_friends": null,
    "pronunciation": null
  },
  "l1": {},
  "provenance": {
    "created": "2026-10-08T00:59:24Z",
    "modified": "2026-10-21T13:15:16Z",
    "drafted_by": "anthropic/claude-sonnet-5",
    "run_id": "20261008T005514Z-fvsnbv",
    "reviews": [
      {
        "run_id": "20261008T005514Z-fvsnbv",
        "role": "reviewer-a",
        "model": "openai/gpt-5.6-terra",
        "date": "2026-10-08",
        "file": "reviews/20261008T005514Z-fvsnbv/shore-n.json",
        "ok": 30,
        "issues": 5,
        "blocking": 4
      },
      {
        "run_id": "20261008T005514Z-fvsnbv",
        "role": "reviewer-b",
        "model": "google/gemini-3.1-pro-preview",
        "date": "2026-10-08",
        "file": "reviews/20261008T005514Z-fvsnbv/shore-n.json",
        "ok": 34,
        "issues": 0,
        "blocking": 0
      },
      {
        "run_id": "20261021T130320Z-wepupa",
        "role": "reviewer-a",
        "model": "openai/gpt-5.6-terra",
        "date": "2026-10-21",
        "file": "reviews/20261021T130320Z-wepupa/shore-n.json",
        "ok": 34,
        "issues": 0,
        "blocking": 0
      },
      {
        "run_id": "20261021T130320Z-wepupa",
        "role": "reviewer-b",
        "model": "google/gemini-3.1-pro-preview",
        "date": "2026-10-21",
        "file": "reviews/20261021T130320Z-wepupa/shore-n.json",
        "ok": 34,
        "issues": 0,
        "blocking": 0
      }
    ],
    "status": "reviewed",
    "flags": [],
    "notes": null
  }
}
