{
  "schema_version": "1.0",
  "id": "cousin-n",
  "slug": "cousin-n",
  "headword": "cousin",
  "pos": "n",
  "homograph": 1,
  "variants": [],
  "pronunciation": {
    "american": {
      "ipa": "ˈkʌz.ən",
      "source": "model:anthropic/claude-sonnet-5",
      "checked_by": "agreement:4/4;cmudict:agree",
      "status": "verified"
    },
    "british": {
      "ipa": "ˈkʌz.ən",
      "source": "model:anthropic/claude-sonnet-5",
      "checked_by": "agreement:2/3",
      "status": "verified"
    },
    "variants": [],
    "audio": null,
    "notes": "The stress is on the first part: *KUZ-n*. The **ou** sounds like the **u** in **cup**, and the **s** sounds like **z**."
  },
  "inflections": {
    "forms": {
      "plural": "cousins"
    },
    "regular": true,
    "source": "rules",
    "status": "verified",
    "note": null
  },
  "frequency": {
    "band": 1,
    "basis": "editorial",
    "defining_vocabulary": true
  },
  "labels": {
    "register": [],
    "region": [],
    "domain": [],
    "currency": [],
    "attitude": []
  },
  "core_idea": null,
  "senses": [
    {
      "n": 1,
      "signpost": "family",
      "definition": "a child of your aunt or uncle",
      "explanation": "**First cousin** means the same as **cousin**. A **second cousin** is a child of your parent's cousin. A **distant cousin** is a relative in the same family who is not closely related.",
      "grammar": {
        "countability": "countable",
        "transitivity": null,
        "codes": [],
        "patterns": []
      },
      "labels": {
        "register": [],
        "region": [],
        "domain": [],
        "currency": [],
        "attitude": []
      },
      "pronunciation": null,
      "examples": [
        {
          "text": "My cousin Sara is staying with us this week.",
          "note": null,
          "pattern": null
        },
        {
          "text": "I have twelve cousins on my mother's side.",
          "note": null,
          "pattern": null
        },
        {
          "text": "We're cousins: our mothers are sisters.",
          "note": null,
          "pattern": null
        },
        {
          "text": "He's a cousin of mine.",
          "note": null,
          "pattern": null
        }
      ],
      "collocations": [
        {
          "type": "adjective + noun",
          "items": [
            "a first cousin",
            "a second cousin",
            "a distant cousin"
          ]
        },
        {
          "type": "phrase",
          "items": [
            "a cousin of mine",
            "on my mother's side",
            "on my father's side"
          ]
        }
      ],
      "synonyms": [],
      "antonyms": [],
      "compare": [],
      "subsenses": [],
      "adaptation": {
        "semantic": null,
        "grammar": null,
        "culture": null,
        "false_friends": null,
        "pronunciation": null
      },
      "l1": {}
    },
    {
      "n": 2,
      "signpost": "similar thing",
      "definition": "a thing that is similar to another and related to it, often because both have the same origin",
      "explanation": null,
      "grammar": {
        "countability": "countable",
        "transitivity": null,
        "codes": [],
        "patterns": []
      },
      "labels": {
        "register": [],
        "region": [],
        "domain": [],
        "currency": [],
        "attitude": []
      },
      "pronunciation": null,
      "examples": [
        {
          "text": "This soup is a close cousin of the one my grandmother made.",
          "note": null,
          "pattern": null
        },
        {
          "text": "The game is a distant cousin of baseball.",
          "note": null,
          "pattern": null
        }
      ],
      "collocations": [
        {
          "type": "adjective + noun",
          "items": [
            "a close cousin",
            "a distant cousin"
          ]
        }
      ],
      "synonyms": [],
      "antonyms": [],
      "compare": [],
      "subsenses": [],
      "adaptation": {
        "semantic": null,
        "grammar": null,
        "culture": null,
        "false_friends": null,
        "pronunciation": null
      },
      "l1": {}
    }
  ],
  "phrases": [],
  "word_family": [],
  "synonym_discrimination": null,
  "usage_note": null,
  "learner_errors": [
    {
      "incorrect": "She is my cousin sister.",
      "correct": "She is my cousin.",
      "note": "In most varieties of English, **cousin** is used for men and women alike, with no word for brother or sister added."
    }
  ],
  "etymology": null,
  "see_also": [
    {
      "slug": "aunt-n",
      "note": null
    },
    {
      "slug": "uncle-n",
      "note": null
    },
    {
      "slug": "relative-n",
      "note": null
    }
  ],
  "adaptation": {
    "semantic": "\"cousin\" has one form for male and female, and for cousins on the mother's side and the father's side; many languages use separate words.",
    "grammar": null,
    "culture": null,
    "false_friends": null,
    "pronunciation": "\"cousin\": the **ou** sounds like the **u** in **cup**, and the **s** like **z**: *KUZ-n*."
  },
  "l1": {},
  "provenance": {
    "created": "2026-10-02T12:47:09Z",
    "modified": "2026-10-02T12:57:47Z",
    "drafted_by": "anthropic/claude-sonnet-5",
    "run_id": "20261002T124351Z-cjp1fw",
    "reviews": [
      {
        "run_id": "20261002T124351Z-cjp1fw",
        "role": "reviewer-a",
        "model": "openai/gpt-5.6-terra",
        "date": "2026-10-02",
        "file": "reviews/20261002T124351Z-cjp1fw/cousin-n.json",
        "ok": 30,
        "issues": 4,
        "blocking": 2
      },
      {
        "run_id": "20261002T124351Z-cjp1fw",
        "role": "reviewer-b",
        "model": "google/gemini-3.8-flash",
        "date": "2026-10-02",
        "file": "reviews/20261002T124351Z-cjp1fw/cousin-n.json",
        "ok": 34,
        "issues": 0,
        "blocking": 0
      }
    ],
    "status": "reviewed",
    "flags": [],
    "notes": null
  }
}
