{
  "schema_version": "1.0",
  "id": "ment-suffix",
  "slug": "ment-suffix",
  "headword": "-ment",
  "pos": "suffix",
  "homograph": 1,
  "variants": [],
  "pronunciation": {
    "american": {
      "ipa": "mənt",
      "source": "model:anthropic/claude-sonnet-5",
      "checked_by": "agreement:3/3;cmudict:absent",
      "status": "verified"
    },
    "british": {
      "ipa": "mənt",
      "source": "model:anthropic/claude-sonnet-5",
      "checked_by": "agreement:3/3",
      "status": "verified"
    },
    "variants": [],
    "audio": null,
    "notes": "Never stressed; it sounds like *muhnt*. Adding it does not move the stress of the verb (*a-GREE*, *a-GREE-ment*; *de-VEL-op*, *de-VEL-op-ment*)."
  },
  "inflections": {
    "forms": {},
    "regular": true,
    "source": "none",
    "status": "verified",
    "note": null
  },
  "frequency": {
    "band": 3,
    "basis": "editorial",
    "defining_vocabulary": true
  },
  "labels": {
    "register": [],
    "region": [],
    "domain": [],
    "currency": [],
    "attitude": []
  },
  "core_idea": null,
  "senses": [
    {
      "n": 1,
      "signpost": null,
      "definition": "added to a verb to make a noun naming the action of the verb, or its result",
      "explanation": "Many of these nouns name both the action and its result: a **payment** is the act of paying and also the money paid. A final **e** usually stays (*move*, *movement*; *excite*, *excitement*), but not in **argument**. Some are countable, some uncountable, and many are both, so check each word.",
      "grammar": {
        "countability": null,
        "transitivity": null,
        "codes": [],
        "patterns": []
      },
      "labels": {
        "register": [],
        "region": [],
        "domain": [],
        "currency": [],
        "attitude": []
      },
      "pronunciation": null,
      "examples": [
        {
          "text": "We finally reached an agreement.",
          "note": null,
          "pattern": null
        },
        {
          "text": "Thank you for your payment.",
          "note": null,
          "pattern": null
        },
        {
          "text": "There has been a lot of new development in the town.",
          "note": null,
          "pattern": null
        },
        {
          "text": "The new treatment helped her a lot.",
          "note": null,
          "pattern": null
        }
      ],
      "collocations": [],
      "synonyms": [],
      "antonyms": [],
      "compare": [
        {
          "slug": "ation-suffix",
          "note": "**-ation** also makes nouns from verbs: *preparation*, *information*"
        }
      ],
      "subsenses": [],
      "adaptation": {
        "semantic": null,
        "grammar": null,
        "culture": null,
        "false_friends": null,
        "pronunciation": null
      },
      "l1": {}
    }
  ],
  "phrases": [],
  "word_family": [],
  "synonym_discrimination": null,
  "usage_note": null,
  "learner_errors": [
    {
      "incorrect": "They had a big arguement.",
      "correct": "They had a big argument.",
      "note": "The **e** of **argue** is dropped before **-ment**."
    },
    {
      "incorrect": "We bought new equipments for the office.",
      "correct": "We bought new equipment for the office.",
      "note": "**Equipment** is uncountable; it has no plural."
    }
  ],
  "etymology": null,
  "see_also": [],
  "adaptation": {
    "semantic": null,
    "grammar": "Many **-ment** nouns are countable for one example and uncountable for the general idea: *an improvement*, but *room for improvement*. A translation may need a different word, or a plural, for each use.",
    "culture": null,
    "false_friends": null,
    "pronunciation": null
  },
  "l1": {},
  "provenance": {
    "created": "2026-10-23T00:48:59Z",
    "modified": "2026-10-23T00:51:17Z",
    "drafted_by": "anthropic/claude-sonnet-5",
    "run_id": "20261023T004422Z-rm5wd1",
    "reviews": [
      {
        "run_id": "20261023T004422Z-rm5wd1",
        "role": "reviewer-a",
        "model": "openai/gpt-5.6-terra",
        "date": "2026-10-23",
        "file": "reviews/20261023T004422Z-rm5wd1/ment-suffix.json",
        "ok": 23,
        "issues": 2,
        "blocking": 2
      },
      {
        "run_id": "20261023T004422Z-rm5wd1",
        "role": "reviewer-b",
        "model": "google/gemini-3.1-pro-preview",
        "date": "2026-10-23",
        "file": "reviews/20261023T004422Z-rm5wd1/ment-suffix.json",
        "ok": 25,
        "issues": 0,
        "blocking": 0
      }
    ],
    "status": "reviewed",
    "flags": [],
    "notes": null
  }
}
